{
  "$schema": "http://json-schema.org/draft-07/schema#",
  "title": "BaselineDiagnosis",
  "type": "object",
  "required": [
    "incident_id",
    "root_cause_guess",
    "reasoning",
    "confidence"
  ],
  "properties": {
    "incident_id": {
      "type": "string",
      "description": "Identifier of the analyzed incident bundle."
    },
    "root_cause_guess": {
      "type": "string",
      "description": "Single-call best guess explanation of the root cause."
    },
    "reasoning": {
      "type": "string",
      "description": "Unverified reasoning behind the diagnosis."
    },
    "confidence": {
      "type": "number",
      "minimum": 0.0,
      "maximum": 1.0,
      "description": "Subjective confidence score reported by LLM (0.0 - 1.0)."
    },
    "evidence": {
      "type": "array",
      "description": "List of evidence excerpts referenced by the baseline model.",
      "items": {
        "type": "object",
        "required": ["source", "reference", "excerpt"],
        "properties": {
          "source": {
            "type": "string",
            "description": "Source category (e.g., logs, metrics, code, git_diff)."
          },
          "reference": {
            "type": "string",
            "description": "Specific line number, timestamp, metric name, or file path."
          },
          "excerpt": {
            "type": "string",
            "description": "Exact text or value cited as evidence."
          }
        },
        "additionalProperties": false
      }
    },
    "suggested_mitigation": {
      "type": "string",
      "description": "Optional general mitigation recommendation."
    }
  },
  "additionalProperties": false
}

